category,item,description,url
eSIM & Connectivity,Travel SIM card,Useful backup option for international connectivity,https://www.amazon.com/s?k=travel+sim+card+international
eSIM & Connectivity,Portable Wi-Fi hotspot,Useful when traveling with multiple devices or companions,https://www.amazon.com/s?k=portable+wifi+hotspot+travel
eSIM & Connectivity,Travel phone accessories,Helpful for offline maps hotel addresses and arrival prep,https://www.amazon.com/s?k=travel+phone+accessories
Packing Essentials,Packing cubes,Useful for separating clothes and organizing carry-on luggage,https://www.amazon.com/s?k=packing+cubes+travel
Packing Essentials,Cable organizer pouch,Helps keep chargers adapters and small tech accessories together,https://www.amazon.com/s?k=cable+organizer+pouch+travel
Packing Essentials,Travel toiletry bag,Useful for keeping liquids skincare and bathroom items easy to find,https://www.amazon.com/s?k=travel+toiletry+bag
Flight Comfort,Travel pillow,May help make long flights more comfortable,https://www.amazon.com/s?k=travel+pillow+airplane
Flight Comfort,Eye mask and earplugs,Simple tools for rest especially on overnight flights,https://www.amazon.com/s?k=travel+eye+mask+earplugs
Flight Comfort,Collapsible water bottle,Useful after airport security and during long travel days,https://www.amazon.com/s?k=collapsible+travel+water+bottle
Power & Charging,Compact power bank,Useful for keeping your phone charged during long travel days,https://www.amazon.com/s?k=compact+power+bank+travel
Power & Charging,Universal travel adapter,Helpful when visiting countries with different plug types,https://www.amazon.com/s?k=universal+travel+adapter
Power & Charging,USB-C charging cable,Keep one spare cable in your personal item or tech pouch,https://www.amazon.com/s?k=usb+c+charging+cable+travel
Travel Safety,Passport holder,Useful for keeping passport cards and boarding passes together,https://www.amazon.com/s?k=passport+holder+travel
Travel Safety,RFID travel wallet,A simple way to organize cards cash and documents,https://www.amazon.com/s?k=rfid+travel+wallet
Travel Safety,Luggage tag,Helpful for identifying bags and adding contact information,https://www.amazon.com/s?k=luggage+tag+travel
Camera Travel Gear,Camera strap,Useful for walking days city trips and casual travel shooting,https://www.amazon.com/s?k=travel+camera+strap
Camera Travel Gear,SD card case,Helps keep memory cards organized and easier to find,https://www.amazon.com/s?k=sd+card+case+travel
Camera Travel Gear,Lens cleaning kit,Useful before important photos especially during outdoor trips,https://www.amazon.com/s?k=camera+lens+cleaning+kit+travel
