category,item,description,url,priority,buyer_intent,monetization,article_slug
eSIM & Connectivity,Travel SIM card,Useful backup option for international connectivity,https://www.amazon.com/s?k=travel+sim+card+international,2,medium,amazon,
eSIM & Connectivity,Portable Wi-Fi hotspot,Useful when traveling with multiple devices or companions,https://www.amazon.com/s?k=portable+wifi+hotspot+travel,1,high,amazon,
eSIM & Connectivity,Travel phone accessories,Helpful for offline maps hotel addresses and arrival prep,https://www.amazon.com/s?k=travel+phone+accessories,3,medium,amazon,
Packing Essentials,Travel toiletry bag,Useful for keeping liquids skincare and bathroom items easy to find,https://www.amazon.com/s?k=travel+toiletry+bag,1,high,amazon,articles/airport-security-liquids.html
Packing Essentials,Packing cubes,Useful for separating clothes and organizing carry-on luggage,https://www.amazon.com/s?k=packing+cubes+travel,2,high,amazon,
Packing Essentials,Cable organizer pouch,Helps keep chargers adapters and small tech accessories together,https://www.amazon.com/s?k=cable+organizer+pouch+travel,3,medium,amazon,
Flight Comfort,Travel pillow,May help make long flights more comfortable,https://www.amazon.com/s?k=travel+pillow+airplane,1,high,amazon,
Flight Comfort,Eye mask and earplugs,Simple tools for rest especially on overnight flights,https://www.amazon.com/s?k=travel+eye+mask+earplugs,2,medium,amazon,
Flight Comfort,Collapsible water bottle,Useful after airport security and during long travel days,https://www.amazon.com/s?k=collapsible+travel+water+bottle,3,medium,amazon,
Power & Charging,Compact power bank,Useful for keeping your phone charged during long travel days,https://www.amazon.com/s?k=compact+power+bank+travel,1,high,amazon,
Power & Charging,Universal travel adapter,Helpful when visiting countries with different plug types,https://www.amazon.com/s?k=universal+travel+adapter,2,high,amazon,
Power & Charging,USB-C charging cable,Keep one spare cable in your personal item or tech pouch,https://www.amazon.com/s?k=usb+c+charging+cable+travel,3,medium,amazon,
Travel Safety,Passport holder,Useful for keeping passport cards and boarding passes together,https://www.amazon.com/s?k=passport+holder+travel,2,medium,amazon,
Travel Safety,RFID travel wallet,A simple way to organize cards cash and documents,https://www.amazon.com/s?k=rfid+travel+wallet,1,high,amazon,
Travel Safety,Luggage tag,Helpful for identifying bags and adding contact information,https://www.amazon.com/s?k=luggage+tag+travel,3,low,amazon,
Camera Travel Gear,Camera strap,Useful for walking days city trips and casual travel shooting,https://www.amazon.com/s?k=travel+camera+strap,1,medium,amazon,
Camera Travel Gear,SD card case,Helps keep memory cards organized and easier to find,https://www.amazon.com/s?k=sd+card+case+travel,2,medium,amazon,
Camera Travel Gear,Lens cleaning kit,Useful before important photos especially during outdoor trips,https://www.amazon.com/s?k=camera+lens+cleaning+kit+travel,3,low,amazon,
