category,item,description,url,priority,buyer_intent,monetization,article_slug
eSIM & Connectivity,Airalo travel eSIM (store),Buy a country or regional eSIM before you fly — the marketplace we reference most in our guides,https://airalo.tpx.lu/ctddHmQY,2,medium,affiliate,
eSIM & Connectivity,GlocalMe G4 Pro mobile hotspot,SIM-free pocket WiFi that covers 200+ countries — the shared-connection option for groups,https://www.amazon.com/dp/B07YDN7P1C?tag=packlightpick-20,1,high,amazon,
eSIM & Connectivity,Travel phone accessories,Helpful for offline maps hotel addresses and arrival prep,https://www.amazon.com/s?k=travel+phone+accessories&tag=packlightpick-20,3,medium,amazon,
Packing Essentials,BAGSMART hanging toiletry bag,Folding organizer with a hanging hook — keeps liquids and skincare easy to reach in small bathrooms,https://www.amazon.com/dp/B01BWJDKJ0?tag=packlightpick-20,1,high,amazon,articles/airport-security-liquids.html
Packing Essentials,BAGAIL packing cubes (8-piece set),Mesh-top cubes plus shoe and laundry bags — the simplest way to keep a carry-on organized,https://www.amazon.com/dp/B08S35399Y?tag=packlightpick-20,2,high,amazon,
Packing Essentials,Cable organizer pouch,Helps keep chargers adapters and small tech accessories together,https://www.amazon.com/s?k=cable+organizer+pouch+travel&tag=packlightpick-20,3,medium,amazon,
Flight Comfort,Cabeau Evolution S3 travel pillow,Memory-foam neck pillow with seat straps so your head doesn't fall forward on long flights,https://www.amazon.com/dp/B079X4S4DQ?tag=packlightpick-20,1,high,amazon,
Flight Comfort,MZOO 3D contoured sleep mask,Zero-pressure eye cups that block light without touching your lashes — overnight-flight staple,https://www.amazon.com/dp/B07KC5DWCC?tag=packlightpick-20,2,medium,amazon,
Flight Comfort,Collapsible water bottle,Useful after airport security and during long travel days,https://www.amazon.com/s?k=collapsible+travel+water+bottle&tag=packlightpick-20,3,medium,amazon,
Power & Charging,Anker PowerCore 10000 power bank,Pocket-size 10000 mAh charger that stays within airline carry-on battery rules,https://www.amazon.com/dp/B01B12PTOM?tag=packlightpick-20,1,high,amazon,
Power & Charging,EPICKA TA-105 universal adapter,One adapter for US EU UK AU sockets with USB-C and USB-A ports — covers nearly every destination,https://www.amazon.com/dp/B078S3M2NX?tag=packlightpick-20,2,high,amazon,
Power & Charging,USB-C charging cable,Keep one spare cable in your personal item or tech pouch,https://www.amazon.com/s?k=usb+c+charging+cable+travel&tag=packlightpick-20,3,medium,amazon,
Travel Safety,Passport holder,Useful for keeping passport cards and boarding passes together,https://www.amazon.com/s?k=passport+holder+travel&tag=packlightpick-20,2,medium,amazon,
Travel Safety,Zoppen RFID passport wallet,Tri-fold organizer for passport cards and boarding passes with RFID-blocking lining,https://www.amazon.com/dp/B07CLFX2V4?tag=packlightpick-20,1,high,amazon,
Travel Safety,Luggage tag,Helpful for identifying bags and adding contact information,https://www.amazon.com/s?k=luggage+tag+travel&tag=packlightpick-20,3,low,amazon,
Camera Travel Gear,Camera strap,Useful for walking days city trips and casual travel shooting,https://www.amazon.com/s?k=travel+camera+strap&tag=packlightpick-20,1,medium,amazon,
Camera Travel Gear,SD card case,Helps keep memory cards organized and easier to find,https://www.amazon.com/s?k=sd+card+case+travel&tag=packlightpick-20,2,medium,amazon,
Camera Travel Gear,Lens cleaning kit,Useful before important photos especially during outdoor trips,https://www.amazon.com/s?k=camera+lens+cleaning+kit+travel&tag=packlightpick-20,3,low,amazon,
Sun & Beach,Sun Bum Mineral SPF 50 (travel size),3 oz mineral sunscreen made without octinoxate and oxybenzone — fits carry-on liquid rules,https://www.amazon.com/dp/B072KGPSYP?tag=packlightpick-20,1,high,amazon,
Sun & Beach,Packable sun hat,Foldable hat that protects from sun without taking carry-on space,https://www.amazon.com/s?k=packable+travel+sun+hat&tag=packlightpick-20,2,medium,amazon,
Sun & Beach,Polarized travel sunglasses,Reduces glare on beaches and city trips,https://www.amazon.com/s?k=polarized+travel+sunglasses&tag=packlightpick-20,3,medium,amazon,
Sun & Beach,Rainleaf microfiber travel towel,Quick-dry compact towel with a zip pouch — beach gym and hostel days without the bulk,https://www.amazon.com/dp/B077HFZCJ1?tag=packlightpick-20,4,medium,amazon,
Sun & Beach,After-sun aloe gel,Soothing gel for skin after long days in the sun,https://www.amazon.com/s?k=after+sun+aloe+vera+gel+travel&tag=packlightpick-20,5,low,amazon,
Hotel Stay Comfort,Foldable travel slippers,Lightweight slippers for hotel rooms and long flights,https://www.amazon.com/s?k=foldable+travel+slippers&tag=packlightpick-20,1,medium,amazon,
Hotel Stay Comfort,Travel laundry bag,Mesh bag to separate dirty laundry inside your luggage,https://www.amazon.com/s?k=travel+laundry+bag+mesh&tag=packlightpick-20,2,medium,amazon,
Hotel Stay Comfort,Universal sink stopper,Useful for hand-washing clothes in hotel sinks,https://www.amazon.com/s?k=universal+sink+stopper+travel&tag=packlightpick-20,3,low,amazon,
Hotel Stay Comfort,Portable door alarm,Adds a simple layer of security to unfamiliar hotel doors,https://www.amazon.com/s?k=portable+door+alarm+travel&tag=packlightpick-20,4,medium,amazon,
Hotel Stay Comfort,Travel sleep mask,Blocks light in hotel rooms with thin curtains,https://www.amazon.com/s?k=travel+sleep+mask+blackout&tag=packlightpick-20,5,medium,amazon,
Travel Health & Insurance,Compare travel insurance plans,Plans like SafetyWing cover short trips and longer international stays,https://safetywing.com/nomad-insurance,1,high,external,
Travel Health & Insurance,Travel first-aid kit,Compact kit useful for minor cuts headaches and allergies,https://www.amazon.com/s?k=travel+first+aid+kit&tag=packlightpick-20,2,medium,amazon,
Travel Health & Insurance,Compression socks,May help reduce leg swelling on long flights,https://www.amazon.com/s?k=compression+socks+long+flight&tag=packlightpick-20,3,high,amazon,
Travel Health & Insurance,Motion sickness bands,Drug-free wristbands for nausea on planes boats or cars,https://www.amazon.com/s?k=motion+sickness+bands+travel&tag=packlightpick-20,4,medium,amazon,
Travel Health & Insurance,Travel medication organizer,Daily pill case for organizing meds across time zones,https://www.amazon.com/s?k=travel+medication+organizer+pill+case&tag=packlightpick-20,5,medium,amazon,
